{
  "accepted_at": "2026-07-21T10:02:06Z",
  "completion_id": "completion_synthetic",
  "completion_receipt_digest": "sha256:06db7c074b4efb8edffeaa4297df5e7e6f34214613f2a76081a1b6aece498018",
  "credential": {
    "credential_id": "credential_receiving_resume",
    "expires_at": "2026-08-20T10:00:00Z",
    "replay_completion_id": "completion_synthetic",
    "state": "completion_replay_or_delete_only"
  },
  "local_cleanup": {
    "diagnostic_receipt_digests": [
      "sha256:129a3dcd8a7866b3d8f1186c8090f91773e7590d641acedd8a17b72f647a12d9"
    ],
    "manifest_digest": "sha256:cc469bf542463fbece5e32e1fa3909e3545d1fc215d4c8143cf3d9994c59b7c7",
    "segment_receipt_digests": [
      "sha256:8ba85bb0f2e61f0e45e440e014b2500ccc22dc54d34c63376d1ec3af91b4b280"
    ],
    "state": "authorized_after_durable_receipt"
  },
  "message_type": "completion_receipt",
  "processing_job": {
    "build_id": "build_synthetic",
    "build_identity_digest": "sha256:53effba69a9d01818c4bf41763e97833cc3dc46ab45c9fd7a1e027b8e1707c91",
    "completed_at": null,
    "contract_version": "tacua.processing-job@1.0.0",
    "execution": {
      "egress": {
        "authorization_decision_id": null,
        "authorized": false,
        "destinations": [],
        "policy": "default_deny"
      },
      "max_attempts": 3,
      "mode": "async"
    },
    "failure": null,
    "inputs": {
      "capture_manifest_digest": "sha256:cc469bf542463fbece5e32e1fa3909e3545d1fc215d4c8143cf3d9994c59b7c7",
      "context_sources": [
        {
          "access": "read_only",
          "availability": "available",
          "kind": "mobile_repository",
          "snapshot_digest": "sha256:7777777777777777777777777777777777777777777777777777777777777777",
          "source_id": "repo_synthetic",
          "unavailable": null
        },
        {
          "access": "read_only",
          "availability": "unavailable",
          "kind": "sentry",
          "snapshot_digest": null,
          "source_id": "sentry_synthetic",
          "unavailable": {
            "detail": "The optional connector was not configured.",
            "reason": "not_configured"
          }
        }
      ],
      "diagnostic_envelope_digests": [
        "sha256:e8f3e81881cedcd226ed40799d7c8ea412fbf9460350b54552740e8c7c8281f2"
      ]
    },
    "job_digest": "sha256:8e6f92a0f493fe774f4e9de630acb78b04a5544fe9437394e1a00780a6c04f3a",
    "job_id": "job_synthetic",
    "job_version": 1,
    "media_type": "application/vnd.tacua.processing-job+json;version=1.0.0",
    "organization_id": "org_synthetic",
    "outputs": null,
    "pipeline": {
      "pipeline_version": "tacua.pipeline@1.0.0",
      "stages": [
        {
          "attempt_count": 0,
          "completed_at": null,
          "detail": null,
          "name": "transcribe",
          "started_at": null,
          "state": "pending"
        },
        {
          "attempt_count": 0,
          "completed_at": null,
          "detail": null,
          "name": "align",
          "started_at": null,
          "state": "pending"
        },
        {
          "attempt_count": 0,
          "completed_at": null,
          "detail": null,
          "name": "correlate",
          "started_at": null,
          "state": "pending"
        },
        {
          "attempt_count": 0,
          "completed_at": null,
          "detail": null,
          "name": "research",
          "started_at": null,
          "state": "pending"
        },
        {
          "attempt_count": 0,
          "completed_at": null,
          "detail": null,
          "name": "generate_tickets",
          "started_at": null,
          "state": "pending"
        }
      ]
    },
    "previous_job_digest": null,
    "project_id": "project_synthetic",
    "requested_at": "2026-07-21T10:02:06Z",
    "session_id": "session_synthetic",
    "started_at": null,
    "status": "queued"
  },
  "protocol_version": "tacua.sdk-backend@1.0.0",
  "request_digest": "sha256:7d17395a2a44ecdedd075722b686560eadd7547252e5caf618e911bd0c2cdbbe",
  "scope_digest": "sha256:c38600d56cdb3bc8a0d94c0dd7e6323f863d1ccbc6953b6c71421e7c08512a20",
  "session_id": "session_synthetic"
}
